{
  "schema_version": "ui-state.v1",
  "generated_at": "2026-03-16T00:00:00Z",
  "source": {
    "producer": "fixture",
    "mode": "fixture",
    "adapter": "vnext-6-axis",
    "fixture_name": "workspaces",
    "notes": [
      "Workspace-first synthetic fixture for the current six-axis consumer contract derived from five canonical roots.",
      "Only the reserved local-only mount is represented; no actual project directories are scanned."
    ]
  },
  "species": {
    "root": ".registry",
    "owner": ".registry",
    "catalog_ref": ".registry/index.yaml",
    "items": [
      {
        "id": "human",
        "display_name": "Human",
        "summary": "Canonical species catalog baseline for public fixtures.",
        "source_ref": ".registry/species/human/species.yaml",
        "status": "template",
        "hero_catalog_ref": ".registry/species/human/species.yaml",
        "hero_count": 1
      }
    ],
    "heroes": [
      {
        "id": "wandering_knight",
        "display_name": "Wandering Knight",
        "summary": "Inline hero candidate carried by the species canon sample.",
        "source_ref": ".registry/species/human/species.yaml",
        "status": "template",
        "species_id": "human"
      }
    ]
  },
  "units": {
    "root": ".unit",
    "owner": ".unit",
    "items": [
      {
        "id": "vanguard_01",
        "display_name": "Vanguard 01",
        "summary": "Canonical active unit sample with sanitized owner surfaces only.",
        "source_ref": ".unit/vanguard_01/unit.yaml",
        "status": "active",
        "identity": {
          "profile_ref": "vanguard_field_alpha",
          "species_id": "human",
          "hero_id": "wandering_knight"
        },
        "class_ids": [
          "knight"
        ],
        "required_dirs": [
          "policy",
          "protocols",
          "runtime",
          "memory",
          "sessions",
          "autonomic",
          "artifacts"
        ]
      }
    ]
  },
  "classes": {
    "root": ".registry",
    "owner": ".registry",
    "catalog_ref": ".registry/index.yaml",
    "items": [
      {
        "id": "knight",
        "display_name": "Knight",
        "summary": "Reusable class canon sample with class-local assign/ref files.",
        "source_ref": ".registry/classes/knight/class.yaml",
        "status": "template",
        "knowledge_refs_source_ref": ".registry/classes/knight/knowledge_refs.yaml",
        "knowledge_refs_count": 0,
        "skill_refs_source_ref": ".registry/classes/knight/skill_refs.yaml",
        "skill_refs_count": 0,
        "tool_refs_source_ref": ".registry/classes/knight/tool_refs.yaml",
        "tool_refs_count": 0,
        "profiles_dir": ".registry/classes/knight",
        "manifests_dir": ".registry/classes/knight"
      }
    ]
  },
  "workflows": {
    "root": ".workflow",
    "owner": ".workflow",
    "catalog_ref": ".workflow/index.yaml",
    "items": [
      {
        "id": "frontline_assault",
        "display_name": "Frontline Assault",
        "summary": "Frontline Assault workflow canon with curated history only.",
        "source_ref": ".workflow/frontline_assault/workflow.yaml",
        "status": "active",
        "role_slots_ref": ".workflow/frontline_assault/role_slots.yaml",
        "step_graph_ref": ".workflow/frontline_assault/step_graph.yaml",
        "handoff_rules_ref": ".workflow/frontline_assault/handoff_rules.yaml",
        "monster_rules_ref": ".workflow/frontline_assault/monster_rules.yaml",
        "party_compatibility_ref": ".workflow/frontline_assault/party_compatibility.yaml",
        "history_policy": "curated_summary_only",
        "history_ref": ".workflow/frontline_assault/history/README.md"
      }
    ]
  },
  "parties": {
    "root": ".party",
    "owner": ".party",
    "catalog_ref": ".party/index.yaml",
    "items": [
      {
        "id": "systems_engineering_cell",
        "display_name": "Systems Engineering Cell",
        "summary": "Systems Engineering Cell party template with sanitized stats guidance only.",
        "source_ref": ".party/systems_engineering_cell/party.yaml",
        "status": "active",
        "member_slots_ref": ".party/systems_engineering_cell/member_slots.yaml",
        "allowed_species_ref": ".party/systems_engineering_cell/allowed_species.yaml",
        "allowed_classes_ref": ".party/systems_engineering_cell/allowed_classes.yaml",
        "allowed_workflows_ref": ".party/systems_engineering_cell/allowed_workflows.yaml",
        "appserver_profile_ref": ".party/systems_engineering_cell/appserver_profile.yaml",
        "stats_policy": "curated_summary_only",
        "stats_ref": ".party/systems_engineering_cell/stats/README.md"
      }
    ]
  },
  "workspaces": {
    "root": "_workspaces",
    "owner": "_workspaces",
    "mode": "local_only_mount",
    "mount_status": "reserved_public_root",
    "local_scan_enabled": false,
    "projects": [],
    "notes": [
      "Public fixtures never materialize _workspaces/<project_code>/.",
      "Synthetic workspaces payloads describe the reserved local-only mount only."
    ]
  },
  "overview": {
    "body_id": null,
    "class_id": "knight",
    "active_profile": null,
    "active_species": {
      "id": "human",
      "display_name": "Human",
        "summary": "Canonical species catalog baseline for public fixtures.",
      "source_ref": ".registry/species/human/species.yaml",
      "active": true
    },
    "active_hero": {
      "id": "wandering_knight",
      "display_name": "Wandering Knight",
      "summary": "Inline hero candidate carried by the species canon sample.",
      "source_ref": ".registry/species/human/species.yaml",
      "active": true
    },
    "sections_present": {
      "present": 5,
      "total": 5
    },
    "installed_counts": {
      "skills": 0,
      "tools": 0,
      "knowledge": 0,
      "workflows": 1
    },
    "equipped_counts": {
      "skills": 0,
      "tools": 0,
      "knowledge": 0,
      "workflows": 1
    },
    "workspace_counts": {
      "total": 0,
      "bound": 0,
      "unbound": 0,
      "invalid": 0
    },
    "warnings": 1,
    "errors": 0,
    "overall_status": "warning",
    "status_note": "Public fixtures project only the reserved local-only workspace mount."
  },
  "body": {
    "meta": {
      "body_id": null,
      "display_name": "Vanguard 01",
      "version": null,
      "operating_context": "unit_owner_projection",
      "status": "ready"
    },
    "active_species": {
      "id": "human",
      "display_name": "Human",
      "summary": "Canonical species catalog baseline for public fixtures.",
      "source_ref": ".registry/species/human/species.yaml",
      "active": true
    },
    "active_hero": {
      "id": "wandering_knight",
      "display_name": "Wandering Knight",
      "summary": "Inline hero candidate carried by the species canon sample.",
      "source_ref": ".registry/species/human/species.yaml",
      "active": true
    },
    "section_presence": [
      {
        "id": "policy",
        "path": ".unit/vanguard_01/policy",
        "present": true,
        "status": "present"
      },
      {
        "id": "protocols",
        "path": ".unit/vanguard_01/protocols",
        "present": true,
        "status": "present"
      },
      {
        "id": "runtime",
        "path": ".unit/vanguard_01/runtime",
        "present": true,
        "status": "present"
      },
      {
        "id": "memory",
        "path": ".unit/vanguard_01/memory",
        "present": true,
        "status": "present"
      },
      {
        "id": "sessions",
        "path": ".unit/vanguard_01/sessions",
        "present": true,
        "status": "present"
      },
      {
        "id": "autonomic",
        "path": ".unit/vanguard_01/autonomic",
        "present": true,
        "status": "present"
      },
      {
        "id": "artifacts",
        "path": ".unit/vanguard_01/artifacts",
        "present": true,
        "status": "present"
      }
    ],
    "section_summaries": [
      {
        "section_id": "policy",
        "title": "Policy",
        "summary": "Unit-owned operating boundary surface.",
        "status": "present",
        "present": true
      },
      {
        "section_id": "protocols",
        "title": "Protocols",
        "summary": "Unit-owned handoff and request contract.",
        "status": "present",
        "present": true
      },
      {
        "section_id": "runtime",
        "title": "State",
        "summary": "Unit assembly surface without raw runs.",
        "status": "present",
        "present": true
      },
      {
        "section_id": "memory",
        "title": "Memory",
        "summary": "Curated unit continuity surface only.",
        "status": "present",
        "present": true
      },
      {
        "section_id": "sessions",
        "title": "Sessions",
        "summary": "Session continuity surface without transcripts.",
        "status": "present",
        "present": true
      },
      {
        "section_id": "autonomic",
        "title": "Autonomic",
        "summary": "Self-check and healing surface.",
        "status": "present",
        "present": true
      },
      {
        "section_id": "artifacts",
        "title": "Artifacts",
        "summary": "Sanitized reusable artifacts only.",
        "status": "present",
        "present": true
      }
    ],
    "current_bindings": {
      "class_binding": {
        "status": "present",
        "class_id": "knight",
        "active_profile": null
      },
      "workspace_binding": {
        "status": "inactive",
        "active_workspace": null,
        "candidate_count": 0
      },
      "precedence": [
        ".unit owns active bindings",
        ".registry/classes provides reusable packages only",
        "_workspaces is opt-in local-only mount"
      ]
    }
  },
  "class_view": {
    "class_id": "knight",
    "class_name": "Knight",
    "class_version": null,
    "active_profile": null,
    "rows": {
      "skills": [],